<?xml version="1.0" encoding="UTF-8"?>
<?xml-stylesheet type="text/xsl" href="../XSLT/NatureLandscape.xslt"?>
<imgcontainer xmlns:xsi="http://www.w3.org/2001/XMLSchema-instance" xsi:noNamespaceSchemaLocation="../XSD/Gallery.xsd">
    <bigbox class="bigbox">
        <imgbox id="imgbox">
            <img class="img" src="../Images/Wall arts/20230219_212754.jpg" alt=''/>
            <middle class="middle">
                <text class="text">
                    <a href="../Webpages/Reservationform.php">Reserve</a>
                    <a href="../Webpages/Login.php" id="login">login to buy!</a>
                    <a href="../Images/Wall arts/20230219_212754.jpg" target="_self" id="view">View</a>
                    <a href="../Webpages/Buy.php" id="Buy">buy</a>
                </text>
            </middle>
        </imgbox>
        <imgbox id="imgbox">
            <img class="img" src="../Images/Wall arts/birmingham-museums-trust-9pOXS0ZGPDM-unsplash.jpg" alt=''/>
            <middle class="middle">
                <text class="text">
                    <a href="../Webpages/Reservationform.php">Reserve</a>
                    <a href="../Webpages/Login.php" id="login">login to buy!</a>
                    <a href="../Images/Wall arts/birmingham-museums-trust-9pOXS0ZGPDM-unsplash.jpg" target="_self" id="view">View</a>
                    <a href="../Webpages/Buy.php" id="Buy">buy</a>
                </text>
            </middle>
        </imgbox>
        <imgbox id="imgbox">
            <img class="img" src="../Images/Wall arts/copyR@AD_AdobeLr_19_02_2023 (2).jpg" alt=''/>
            <middle class="middle">
                <text class="text">
                    <a href="../Webpages/Reservationform.php">Reserve</a>
                    <a href="../Webpages/Login.php" id="login">login to buy!</a>
                    <a href="../Images/Wall arts/copyR@AD_AdobeLr_19_02_2023 (2).jpg" target="_self" id="view">View</a>
                    <a href="../Webpages/Buy.php" id="Buy">buy</a>
                </text>
            </middle>
        </imgbox>
        <imgbox id="imgbox">
            <img class="img" src="../Images/Wall arts/copyR@AD_AdobeLr_19_02_2023 (3).jpg" alt=''/>
            <middle class="middle">
                <text class="text">
                    <a href="../Webpages/Reservationform.php">Reserve</a>
                    <a href="../Webpages/Login.php" id="login">login to buy!</a>
                    <a href="../Images/Wall arts/copyR@AD_AdobeLr_19_02_2023 (3).jpg" target="_self" id="view">View</a>
                    <a href="../Webpages/Buy.php" id="Buy">buy</a>
                </text>
            </middle>
        </imgbox>
        <imgbox id="imgbox">
            <img class="img" src="../Images/Wall arts/copyR@AD_AdobeLr_19_02_2023-02.jpg" alt=''/>
            <middle class="middle">
                <text class="text">
                    <a href="../Webpages/Reservationform.php">Reserve</a>
                    <a href="../Webpages/Login.php" id="login">login to buy!</a>
                    <a href="../Images/Wall arts/copyR@AD_AdobeLr_19_02_2023-02.jpg" target="_self" id="view">View</a>
                    <a href="../Webpages/Buy.php" id="Buy">buy</a>
                </text>
            </middle>
        </imgbox>
        <imgbox id="imgbox">
            <img class="img" src="../Images/Wall arts/copyR@AD_AdobeLr_19_02_2023-03.jpg" alt=''/>
            <middle class="middle">
                <text class="text">
                    <a href="../Webpages/Reservationform.php">Reserve</a>
                    <a href="../Webpages/Login.php" id="login">login to buy!</a>
                    <a href="../Images/Wall arts/copyR@AD_AdobeLr_19_02_2023-03.jpg" target="_self" id="view">View</a>
                    <a href="../Webpages/Buy.php" id="Buy">buy</a>
                </text>
            </middle>
        </imgbox>
        <imgbox id="imgbox">
            <img class="img" src="../Images/Wall arts/copyR@AD_AdobeLr_19_02_2023-05.jpg" alt=''/>
            <middle class="middle">
                <text class="text">
                    <a href="../Webpages/Reservationform.php">Reserve</a>
                    <a href="../Webpages/Login.php" id="login">login to buy!</a>
                    <a href="../Images/Wall arts/copyR@AD_AdobeLr_19_02_2023-05.jpg" target="_self" id="view">View</a>
                    <a href="../Webpages/Buy.php" id="Buy">buy</a>
                </text>
            </middle>
        </imgbox>
        <imgbox id="imgbox">
            <img class="img" src="../Images/Wall arts/copyR@AD_AdobeLr_19_02_2023-06.jpg" alt=''/>
            <middle class="middle">
                <text class="text">
                    <a href="../Webpages/Reservationform.php">Reserve</a>
                    <a href="../Webpages/Login.php" id="login">login to buy!</a>
                    <a href="../Images/Wall arts/copyR@AD_AdobeLr_19_02_2023-06.jpg" target="_self" id="view">View</a>
                    <a href="../Webpages/Buy.php" id="Buy">buy</a>
                </text>
            </middle>
        </imgbox>
        <imgbox id="imgbox">
            <img class="img" src="../Images/Wall arts/copyR@AD_AdobeLr_19_02_2023-09.jpg" alt=''/>
            <middle class="middle">
                <text class="text">
                    <a href="../Webpages/Reservationform.php">Reserve</a>
                    <a href="../Webpages/Login.php" id="login">login to buy!</a>
                    <a href="../Images/Wall arts/copyR@AD_AdobeLr_19_02_2023-09.jpg" target="_self" id="view">View</a>
                    <a href="../Webpages/Buy.php" id="Buy">buy</a>
                </text>
            </middle>
        </imgbox>
    </bigbox>
</imgcontainer>
